{"document_id":"doc_bgrreviewedsource0001","principal_id":"aaaaaaaaaaaaaaaaaaaaaaaaaaaaaaaaaaaaaaaaaaaaaaaaaaaaaaaaaaaaaaaa","collection":"nanolime","active_version":"ver_aaaaaaaaaaaaaaaaaaaaaaaaaaaaaaaaaaaaaaaaaaaaaaaaaaaaaaaaaaaaaaaa","prior_version":null,"candidate_version":null,"pointer_revision":1}
